{
  "meta": {
    "name": "2026年8月12日全球新闻股票推演",
    "description": "基于 2026-08-11 19:40 ~ 2026-08-12 07:40 窗口内国内/国际/香港新闻，推演相关股票短中长期多空方向。",
    "category": "daily",
    "source": "2026-08-12 综合整理（窗口 2026-08-11 19:40 ~ 2026-08-12 07:40）",
    "version": "2026-08-12",
    "update_time": "2026-08-12T07:40:00+08:00",
    "declaration": "以下为基于公开新闻的逻辑推演，不构成任何投资建议。"
  },
  "news_analysis": [
    {
      "id": 1,
      "title": "中央政治局会议定调积极财政与适度宽松货币 央行十五五规划落地",
      "logic": "中央政治局会议强调实施更加积极的财政政策和适度宽松的货币政策，央行《十五五改革发展规划》首提双支柱调控框架，货币宽松预期与资本市场改革共振，大金融与顺周期估值修复。",
      "stocks": [
        {
          "name": "中信证券",
          "code": "600030.SH",
          "market": "SH",
          "short_term": "↑",
          "sector": "券商（直接受益）",
          "mid_term": "↑",
          "long_term": "→"
        },
        {
          "name": "东方财富",
          "code": "300059.SZ",
          "market": "SZ",
          "short_term": "↑",
          "sector": "互联网券商",
          "mid_term": "↑",
          "long_term": "→"
        },
        {
          "name": "招商银行",
          "code": "600036.SH",
          "market": "SH",
          "short_term": "→",
          "sector": "银行（估值修复）",
          "mid_term": "→",
          "long_term": "→"
        },
        {
          "name": "工商银行",
          "code": "601398.SH",
          "market": "SH",
          "short_term": "→",
          "sector": "国有大行",
          "mid_term": "→",
          "long_term": "→"
        },
        {
          "name": "万科A",
          "code": "000002.SZ",
          "market": "SZ",
          "short_term": "↑",
          "sector": "地产（政策宽松）",
          "mid_term": "↑",
          "long_term": "→"
        },
        {
          "name": "保利发展",
          "code": "600048.SH",
          "market": "SH",
          "short_term": "↑",
          "sector": "地产",
          "mid_term": "↑",
          "long_term": "→"
        }
      ]
    },
    {
      "id": 2,
      "title": "住房纳入大宗消费范畴 北京等地楼市新政密集出台",
      "logic": "国务院《扩大消费十五五规划》将住房置于大宗消费首位，北京非京籍购房社保降至1年、公积金额度提升至340万，多地密集出台楼市新政，地产链与后周期消费受益。",
      "stocks": [
        {
          "name": "万科A",
          "code": "000002.SZ",
          "market": "SZ",
          "short_term": "↑",
          "sector": "地产开发",
          "mid_term": "↑",
          "long_term": "↑"
        },
        {
          "name": "保利发展",
          "code": "600048.SH",
          "market": "SH",
          "short_term": "↑",
          "sector": "地产",
          "mid_term": "↑",
          "long_term": "↑"
        },
        {
          "name": "招商蛇口",
          "code": "001979.SZ",
          "market": "SZ",
          "short_term": "↑",
          "sector": "地产开发",
          "mid_term": "↑",
          "long_term": "→"
        },
        {
          "name": "东方雨虹",
          "code": "002271.SZ",
          "market": "SZ",
          "short_term": "↑",
          "sector": "防水建材",
          "mid_term": "↑",
          "long_term": "→"
        },
        {
          "name": "欧派家居",
          "code": "603833.SH",
          "market": "SH",
          "short_term": "↑",
          "sector": "定制家居",
          "mid_term": "↑",
          "long_term": "→"
        },
        {
          "name": "美的集团",
          "code": "000333.SZ",
          "market": "SZ",
          "short_term": "↑",
          "sector": "家电（以旧换新）",
          "mid_term": "↑",
          "long_term": "→"
        },
        {
          "name": "贝壳",
          "code": "BEKE",
          "market": "US",
          "short_term": "↑",
          "sector": "房产交易服务平台",
          "mid_term": "↑",
          "long_term": "→"
        }
      ]
    },
    {
      "id": 3,
      "title": "人民银行明确高质量建设债券市场科技板",
      "logic": "央行明确高质量建设债券市场科技板、构建同科技创新相适应的科技金融体制，直接融资扩容利好券商投行与金融IT。",
      "stocks": [
        {
          "name": "中信证券",
          "code": "600030.SH",
          "market": "SH",
          "short_term": "↑",
          "sector": "投行/券商",
          "mid_term": "↑",
          "long_term": "→"
        },
        {
          "name": "恒生电子",
          "code": "600570.SH",
          "market": "SH",
          "short_term": "↑",
          "sector": "金融IT",
          "mid_term": "↑",
          "long_term": "→"
        },
        {
          "name": "同花顺",
          "code": "300033.SZ",
          "market": "SZ",
          "short_term": "→",
          "sector": "金融信息",
          "mid_term": "→",
          "long_term": "→"
        },
        {
          "name": "东方财富",
          "code": "300059.SZ",
          "market": "SZ",
          "short_term": "↑",
          "sector": "券商",
          "mid_term": "↑",
          "long_term": "→"
        }
      ]
    },
    {
      "id": 4,
      "title": "外贸高增助推 人民币对美元汇率创三年半新高",
      "logic": "外贸高增与PPI转正推动在岸人民币创2023年来新高，升值利好航空、造纸等美元负债/进口成本行业，压制出口型企业。",
      "stocks": [
        {
          "name": "中国国航",
          "code": "601111.SH",
          "market": "SH",
          "short_term": "↑",
          "sector": "航空（汇兑+燃油）",
          "mid_term": "↑",
          "long_term": "→"
        },
        {
          "name": "南方航空",
          "code": "600029.SH",
          "market": "SH",
          "short_term": "↑",
          "sector": "航空",
          "mid_term": "↑",
          "long_term": "→"
        },
        {
          "name": "东方航空",
          "code": "600115.SH",
          "market": "SH",
          "short_term": "↑",
          "sector": "航空",
          "mid_term": "↑",
          "long_term": "→"
        },
        {
          "name": "太阳纸业",
          "code": "002078.SZ",
          "market": "SZ",
          "short_term": "↑",
          "sector": "造纸（进口木浆）",
          "mid_term": "↑",
          "long_term": "→"
        },
        {
          "name": "申洲国际",
          "code": "02313.HK",
          "market": "HK",
          "short_term": "↓",
          "sector": "纺织出口（汇率承压）",
          "mid_term": "↓",
          "long_term": "→"
        }
      ]
    },
    {
      "id": 5,
      "title": "高技术产品出口7月增长超五成 出口含新量攀升",
      "logic": "7月出口同比增23.9%、高技术产品出口增超五成，航运、港口及具有全球竞争力的高端制造出口链景气延续。",
      "stocks": [
        {
          "name": "中远海控",
          "code": "601919.SH",
          "market": "SH",
          "short_term": "↑",
          "sector": "集装箱航运",
          "mid_term": "↑",
          "long_term": "→"
        },
        {
          "name": "上港集团",
          "code": "600018.SH",
          "market": "SH",
          "short_term": "↑",
          "sector": "港口",
          "mid_term": "↑",
          "long_term": "→"
        },
        {
          "name": "比亚迪",
          "code": "002594.SZ",
          "market": "SZ",
          "short_term": "↑",
          "sector": "新能源车出口",
          "mid_term": "↑",
          "long_term": "↑"
        },
        {
          "name": "宁德时代",
          "code": "300750.SZ",
          "market": "SZ",
          "short_term": "↑",
          "sector": "动力电池出口",
          "mid_term": "↑",
          "long_term": "↑"
        },
        {
          "name": "立讯精密",
          "code": "002475.SZ",
          "market": "SZ",
          "short_term": "↑",
          "sector": "消费电子出口",
          "mid_term": "↑",
          "long_term": "→"
        }
      ]
    },
    {
      "id": 6,
      "title": "工业富联上半年净利润237.4亿元 同比增95.99%创历史新高",
      "logic": "工业富联上半年净利237.4亿元创历史新高，AI服务器需求爆发验证算力硬件高景气，PCB/CCL链跟涨。",
      "stocks": [
        {
          "name": "工业富联",
          "code": "601138.SH",
          "market": "SH",
          "short_term": "↑↑",
          "sector": "AI服务器",
          "mid_term": "↑↑",
          "long_term": "↑"
        },
        {
          "name": "沪电股份",
          "code": "002463.SZ",
          "market": "SZ",
          "short_term": "↑↑",
          "sector": "PCB（AI服务器）",
          "mid_term": "↑↑",
          "long_term": "↑"
        },
        {
          "name": "生益科技",
          "code": "600183.SH",
          "market": "SH",
          "short_term": "↑",
          "sector": "CCL",
          "mid_term": "↑",
          "long_term": "↑"
        },
        {
          "name": "胜宏科技",
          "code": "300476.SZ",
          "market": "SZ",
          "short_term": "↑↑",
          "sector": "PCB",
          "mid_term": "↑↑",
          "long_term": "↑"
        }
      ]
    },
    {
      "id": 7,
      "title": "宇树科技同步开启申购 世界机器人大会临近催化机器人链",
      "logic": "宇树科技科创板申购中签率极低、发行价150.8元募资约61亿，叠加世界机器人大会临近，人形机器人产业化加速，核心零部件弹性最大。",
      "stocks": [
        {
          "name": "机器人",
          "code": "300024.SZ",
          "market": "SZ",
          "short_term": "↑",
          "sector": "工业机器人本体",
          "mid_term": "↑",
          "long_term": "→"
        },
        {
          "name": "绿的谐波",
          "code": "688017.SH",
          "market": "SH",
          "short_term": "↑↑",
          "sector": "谐波减速器",
          "mid_term": "↑↑",
          "long_term": "↑"
        },
        {
          "name": "双环传动",
          "code": "002472.SZ",
          "market": "SZ",
          "short_term": "↑",
          "sector": "精密传动",
          "mid_term": "↑",
          "long_term": "→"
        },
        {
          "name": "鸣志电器",
          "code": "603728.SH",
          "market": "SH",
          "short_term": "↑",
          "sector": "运动控制",
          "mid_term": "↑",
          "long_term": "→"
        },
        {
          "name": "三花智控",
          "code": "002050.SZ",
          "market": "SZ",
          "short_term": "↑",
          "sector": "热管理/机电",
          "mid_term": "↑",
          "long_term": "→"
        },
        {
          "name": "中大力德",
          "code": "002896.SZ",
          "market": "SZ",
          "short_term": "↑",
          "sector": "减速器",
          "mid_term": "↑",
          "long_term": "→"
        },
        {
          "name": "兆威机电",
          "code": "003021.SZ",
          "market": "SZ",
          "short_term": "↑",
          "sector": "灵巧手/微传动",
          "mid_term": "↑",
          "long_term": "→"
        }
      ]
    },
    {
      "id": 8,
      "title": "字节跳动设AI数据与安全一级部门 阿里云AIDC工期缩短至100天",